<?xml version="1.0" encoding="UTF-8" ?>
<!DOCTYPE ChannelAdminResult SYSTEM "/AdapterFramework/channelAdmin/ChannelAdmin.dtd">
<ChannelAdminResult xmlns:xsi="http://www.w3.org/2001/XMLSchema-instance" xsi:schemaLocation="http://LD-S-TSTzzz:50000/AdapterFramework/channelAdmin/ChannelAdmin.xsd">
	<Channels>
		<Channel>
			<Party></Party>
			<Service>BC_TEST1</Service>
			<ChannelName>qqqq</ChannelName>
			<ChannelID>7f07b93433cb31acb93486b222d74d93</ChannelID>
			<AdapterType>REST</AdapterType>
			<Direction>OUTBOUND</Direction>
			<ActivationState>STOPPED</ActivationState>
			<Control>WEBSERVICE</Control>
			<ShortLog><![CDATA[Server 00 00_49912 : Channel stopped]]></ShortLog>
		</Channel>
	</Channels>
</ChannelAdminResult>
