<?xml version="1.0" encoding="UTF-8" ?>
<!DOCTYPE ChannelStatusResult SYSTEM "/AdapterFramework/channelAdmin/ChannelAdmin.dtd">
<ChannelStatusResult xmlns:xsi="http://www.w3.org/2001/XMLSchema-instance" xsi:schemaLocation="http://host:50000/AdapterFramework/channelAdmin/ChannelAdmin.xsd">
    <Channels>
        <Channel>
            <Party>P_1C</Party>
            <Service>BS</Service>
            <ChannelName>CC_SOAPReceiver_ASOP_EmployeeInformation</ChannelName>
            <ChannelID>3d7c1402a1923383837d986dee3ea4e1</ChannelID>
            <AdapterType>SOAP</AdapterType>
            <Direction>OUTBOUND</Direction>
            <ActivationState>STARTED</ActivationState>
            <ChannelState>OK</ChannelState>
            <Control>SCHEDULER</Control>
        </Channel>
        <Channel>
            <Party></Party>
            <Service>BS2</Service>
            <ChannelName>CC_SOAPReceiver_SalesOrderRequest</ChannelName>
            <ChannelID>77b98eceabc43d6a81f8271814e5e0e4</ChannelID>
            <AdapterType>SOAP</AdapterType>
            <Direction>OUTBOUND</Direction>
            <ActivationState>STARTED</ActivationState>
            <ChannelState>OK</ChannelState>
            <Control>SCHEDULER</Control>
        </Channel>
    </Channels>
</ChannelStatusResult>