<?xml version="1.0" encoding="UTF-8" ?>
<!DOCTYPE ChannelAdminResult SYSTEM "/AdapterFramework/channelAdmin/ChannelAdmin.dtd">
<ChannelAdminResult xmlns:xsi="http://www.w3.org/2001/XMLSchema-instance" xsi:schemaLocation="http://H:50000/AdapterFramework/channelAdmin/ChannelAdmin.xsd">
    <Channels>
        <Channel>
            <Party></Party>
            <Service>BC_TEST1</Service>
            <ChannelName>qqqq</ChannelName>
            <ChannelID>7f07b93433cb31acb93486b222d74d93</ChannelID>
            <AdapterType>REST</AdapterType>
            <Direction>OUTBOUND</Direction>
            <ActivationState>STARTED</ActivationState>
            <ChannelState>OK</ChannelState>
            <Control>SCHEDULER</Control>
            <AdminErrorInformation>com.sap.aii.af.service.administration.impl.WrongAutomationModeException&#x3a;&#x20;The&#x20;channel&#x20;&quot;&#x2f;BC_TEST1&#x2f;qqqq&#x20;&#x28;GUID&#x20;7f07b93433cb31acb93486b222d74d93&#x29;&quot;&#x20;is&#x20;configured&#x20;to&#x20;use&#x20;an&#x20;automation&#x20;mode&#x20;not&#x20;compatible&#x20;with&#x20;the&#x20;type&#x20;of&#x20;the&#x20;current&#x20;principal&#x20;&#x28;WSUSER&#x29;.&#x20;The&#x20;channel&#x20;was&#x20;not&#x20;stopped.&#x20;Change&#x20;the&#x20;channels&#x20;automation&#x20;mode&#x20;and&#x20;repeat&#x20;the&#x20;administrative&#x20;action.&#xa;&#x9;at&#x20;com.sap.aii.af.service.administration.impl.AdminManagerImpl.setChannelActivationState&#x28;AdminManagerImpl.java&#x3a;998&#x29;&#xa;&#x9;at&#x20;com.sap.aii.af.service.administration.impl.AdminManagerImpl.setChannelActivationState&#x28;AdminManagerImpl.java&#x3a;838&#x29;&#xa;&#x9;at&#x20;com.sap.aii.af.app.administration.scheduling.SchedulingServlet.doGet&#x28;SchedulingServlet.java&#x3a;229&#x29;&#xa;&#x9;at&#x20;javax.servlet.http.HttpServlet.service&#x28;HttpServlet.java&#x3a;734&#x29;&#xa;&#x9;at&#x20;javax.servlet.http.HttpServlet.service&#x28;HttpServlet.java&#x3a;847&#x29;&#xa;&#x9;at&#x20;com.sap.engine.services.servlets_jsp.server.Invokable.invoke&#x28;Invokable.java&#x3a;152&#x29;&#xa;&#x9;at&#x20;com.sap.engine.services.servlets_jsp.server.Invokable.invoke&#x28;Invokable.java&#x3a;38&#x29;&#xa;&#x9;at&#x20;com.sap.engine.services.servlets_jsp.server.HttpHandlerImpl.runServlet&#x28;HttpHandlerImpl.java&#x3a;466&#x29;&#xa;&#x9;at&#x20;com.sap.engine.services.servlets_jsp.server.HttpHandlerImpl.handleRequest&#x28;HttpHandlerImpl.java&#x3a;210&#x29;&#xa;&#x9;at&#x20;com.sap.engine.services.httpserver.server.RequestAnalizer.startServlet&#x28;RequestAnalizer.java&#x3a;439&#x29;&#xa;&#x9;at&#x20;com.sap.engine.services.httpserver.server.RequestAnalizer.startServlet&#x28;RequestAnalizer.java&#x3a;428&#x29;&#xa;&#x9;at&#x20;com.sap.engine.services.servlets_jsp.filters.DSRWebContainerFilter.process&#x28;DSRWebContainerFilter.java&#x3a;38&#x29;&#xa;&#x9;at&#x20;com.sap.engine.services.httpserver.chain.AbstractChain.process&#x28;AbstractChain.java&#x3a;78&#x29;&#xa;&#x9;at&#x20;com.sap.engine.services.servlets_jsp.filters.ServletSelector.process&#x28;ServletSelector.java&#x3a;81&#x29;&#xa;&#x9;at&#x20;com.sap.engine.services.httpserver.chain.AbstractChain.process&#x28;AbstractChain.java&#x3a;78&#x29;&#xa;&#x9;at&#x20;com.sap.engine.services.servlets_jsp.filters.ApplicationSelector.process&#x28;ApplicationSelector.java&#x3a;278&#x29;&#xa;&#x9;at&#x20;com.sap.engine.services.httpserver.chain.AbstractChain.process&#x28;AbstractChain.java&#x3a;78&#x29;&#xa;&#x9;at&#x20;com.sap.engine.services.httpserver.filters.WebContainerInvoker.process&#x28;WebContainerInvoker.java&#x3a;85&#x29;&#xa;&#x9;at&#x20;com.sap.engine.services.httpserver.chain.HostFilter.process&#x28;HostFilter.java&#x3a;9&#x29;&#xa;&#x9;at&#x20;com.sap.engine.services.httpserver.chain.AbstractChain.process&#x28;AbstractChain.java&#x3a;78&#x29;&#xa;&#x9;at&#x20;com.sap.engine.services.httpserver.filters.ResponseLogWriter.process&#x28;ResponseLogWriter.java&#x3a;60&#x29;&#xa;&#x9;at&#x20;com.sap.engine.services.httpserver.chain.HostFilter.process&#x28;HostFilter.java&#x3a;9&#x29;&#xa;&#x9;at&#x20;com.sap.engine.services.httpserver.chain.AbstractChain.process&#x28;AbstractChain.java&#x3a;78&#x29;&#xa;&#x9;at&#x20;com.sap.engine.services.httpserver.filters.DefineHostFilter.process&#x28;DefineHostFilter.java&#x3a;27&#x29;&#xa;&#x9;at&#x20;com.sap.engine.services.httpserver.chain.ServerFilter.process&#x28;ServerFilter.java&#x3a;12&#x29;&#xa;&#x9;at&#x20;com.sap.engine.services.httpserver.chain.AbstractChain.process&#x28;AbstractChain.java&#x3a;78&#x29;&#xa;&#x9;at&#x20;com.sap.engine.services.httpserver.filters.MonitoringFilter.process&#x28;MonitoringFilter.java&#x3a;29&#x29;&#xa;&#x9;at&#x20;com.sap.engine.services.httpserver.chain.ServerFilter.process&#x28;ServerFilter.java&#x3a;12&#x29;&#xa;&#x9;at&#x20;com.sap.engine.services.httpserver.chain.AbstractChain.process&#x28;AbstractChain.java&#x3a;78&#x29;&#xa;&#x9;at&#x20;com.sap.engine.services.httpserver.filters.SessionSizeFilter.process&#x28;SessionSizeFilter.java&#x3a;26&#x29;&#xa;&#x9;at&#x20;com.sap.engine.services.httpserver.chain.ServerFilter.process&#x28;ServerFilter.java&#x3a;12&#x29;&#xa;&#x9;at&#x20;com.sap.engine.services.httpserver.chain.AbstractChain.process&#x28;AbstractChain.java&#x3a;78&#x29;&#xa;&#x9;at&#x20;com.sap.engine.services.httpserver.filters.MemoryStatisticFilter.process&#x28;MemoryStatisticFilter.java&#x3a;57&#x29;&#xa;&#x9;at&#x20;com.sap.engine.services.httpserver.chain.ServerFilter.process&#x28;ServerFilter.java&#x3a;12&#x29;&#xa;&#x9;at&#x20;com.sap.engine.services.httpserver.chain.AbstractChain.process&#x28;AbstractChain.java&#x3a;78&#x29;&#xa;&#x9;at&#x20;com.sap.engine.services.httpserver.filters.DSRHttpFilter.process&#x28;DSRHttpFilter.java&#x3a;43&#x29;&#xa;&#x9;at&#x20;com.sap.engine.services.httpserver.chain.ServerFilter.process&#x28;ServerFilter.java&#x3a;12&#x29;&#xa;&#x9;at&#x20;com.sap.engine.services.httpserver.chain.AbstractChain.process&#x28;AbstractChain.java&#x3a;78&#x29;&#xa;&#x9;at&#x20;com.sap.engine.services.httpserver.server.Processor.chainedRequest&#x28;Processor.java&#x3a;468&#x29;&#xa;&#x9;at&#x20;com.sap.engine.services.httpserver.server.Processor&#x24;FCAProcessorThread.process&#x28;Processor.java&#x3a;262&#x29;&#xa;&#x9;at&#x20;com.sap.engine.services.httpserver.server.rcm.RequestProcessorThread.run&#x28;RequestProcessorThread.java&#x3a;56&#x29;&#xa;&#x9;at&#x20;com.sap.engine.core.thread.execution.Executable.run&#x28;Executable.java&#x3a;122&#x29;&#xa;&#x9;at&#x20;com.sap.engine.core.thread.execution.Executable.run&#x28;Executable.java&#x3a;101&#x29;&#xa;&#x9;at&#x20;com.sap.engine.core.thread.execution.CentralExecutor&#x24;SingleThread.run&#x28;CentralExecutor.java&#x3a;328&#x29;&#xa;</AdminErrorInformation>
        </Channel>
    </Channels>
</ChannelAdminResult>